{
  "schemaVersion": "shareslices.verification-fixture/v1",
  "topology": "cloudflare",
  "addresses": {
    "web": "https://app.example.test",
    "api": "https://app.example.test",
    "viewer": "https://app.example.test",
    "content": "https://content.example.test",
    "origin": "https://app.example.test",
    "edge": "https://app.example.test"
  },
  "requiredCapabilities": [
    "trusted-http",
    "viewer",
    "content-only-http",
    "cloudflare-provider-control-plane",
    "authentication-email"
  ],
  "disabledCapabilities": ["kubernetes-network-policy"],
  "expectedNotApplicable": {
    "kubernetes-network-policy": "provider_capability_not_selected"
  }
}
