{
  "schemaVersion": "shareslices.verification-fixture/v1",
  "topology": "kubernetes",
  "addresses": {
    "web": "https://app.example.test",
    "api": "https://app.example.test",
    "viewer": "https://app.example.test",
    "content": "https://content.example-content.test",
    "origin": "https://origin.example.test",
    "edge": "https://app.example.test"
  },
  "requiredCapabilities": [
    "trusted-http",
    "viewer",
    "content-only-http",
    "kubernetes-network-policy",
    "authentication-email"
  ],
  "disabledCapabilities": ["cloudflare-provider-control-plane"],
  "expectedNotApplicable": {
    "cloudflare-provider-bindings": "provider_capability_not_selected"
  }
}
